{
  "id": "mslvl-hshkah-c",
  "he": "מסלול השקעה",
  "en": null,
  "meaning": "חלק נפרד בקופה עם מדיניות השקעה משלו, כמו מסלול מניות; הכסף מושקע לפי המסלול שנבחר",
  "where": [
    "app",
    "gemel-net",
    "statement"
  ],
  "wrapper_ids": [
    "child-savings-bank",
    "child-savings-provident",
    "keren-hishtalmut",
    "kupat-gemel-lehashkaa"
  ],
  "variants": [],
  "rule_ids": [
    "CS-08",
    "KGL-12",
    "KH-20"
  ],
  "source": {
    "url": "https://www.gov.il/BlobFolder/dynamiccollectorresultitem/investmentsoptions16112020/he/2020-9-18.pdf",
    "title": "CMA circular 2020-9-18 \"מסלולי השקעה בקופות גמל - תיקון\" (16 Nov 2020)",
    "publisher": "see title",
    "strength": "primary",
    "checked": "2026-10-22"
  }
}
