{
  "id": "rvvch-hvn-ryaly-e",
  "he": "רווח הון ריאלי",
  "en": null,
  "meaning": "רווח ההון אחרי שמורידים ממנו את החלק שרק משלים את עליית המדד",
  "where": [
    "ad",
    "statement",
    "tax-form"
  ],
  "wrapper_ids": [
    "bank-deposit",
    "brokerage-account",
    "child-savings-bank",
    "child-savings-provident",
    "current-account",
    "government-bond",
    "ira-hishtalmut",
    "ira-provident",
    "keren-hishtalmut",
    "kupat-gemel-lehashkaa",
    "makam",
    "money-market-fund-daily",
    "money-market-fund-renewable",
    "pension-comprehensive",
    "pension-general",
    "provident-for-annuity",
    "savings-plan"
  ],
  "variants": [
    "ריווח הון ריאלי",
    "רווח ההון הריאלי",
    "הרווח הריאלי"
  ],
  "rule_ids": [
    "TXG-12",
    "TXG-13",
    "TXS-03"
  ],
  "source": {
    "url": "https://www.gov.il/BlobFolder/generalpage/income-tax-guide-knowyourright/he/Guides_IncomeTax_da-2025.pdf",
    "title": "רשות המסים, דע זכויותיך וחובותיך 2025 (Tax Authority guide to the 2025 return)",
    "publisher": "see title",
    "strength": "primary",
    "checked": "2026-10-22"
  }
}
