{
  "id": "ptvr-mhgsht-dvch",
  "he": "פטור מהגשת דוח",
  "en": null,
  "meaning": "כשכל ההכנסות מסוגים מסוימים, מתחת לתקרות ונוכה מהן מס במלואו, לא חייבים להגיש דוח שנתי",
  "where": [],
  "wrapper_ids": [
    "bank-deposit",
    "brokerage-account",
    "child-savings-bank",
    "child-savings-provident",
    "current-account",
    "government-bond",
    "ira-hishtalmut",
    "ira-provident",
    "keren-hishtalmut",
    "kupat-gemel-lehashkaa",
    "makam",
    "money-market-fund-daily",
    "money-market-fund-renewable",
    "pension-comprehensive",
    "pension-general",
    "provident-for-annuity",
    "savings-plan"
  ],
  "variants": [
    "פטור מהגשת דין וחשבון",
    "פטור מהגשה דין וחשבון"
  ],
  "rule_ids": [
    "TXG-17",
    "TXG-18"
  ],
  "source": {
    "url": "https://www.gov.il/BlobFolder/generalpage/income-tax-guide-knowyourright/he/Guides_IncomeTax_da-2025.pdf",
    "title": "רשות המסים, דע זכויותיך וחובותיך 2025 (Tax Authority guide to the 2025 return)",
    "publisher": "see title",
    "strength": "primary",
    "checked": "2026-10-22"
  }
}
