{
  "id": "amyt-d",
  "he": "עמית",
  "en": null,
  "meaning": "השם הרשמי לחוסכים שיש להם חשבון בקופת גמל, בקרן פנסיה או בקרן השתלמות",
  "where": [
    "law",
    "statement"
  ],
  "wrapper_ids": [
    "pension-comprehensive",
    "pension-general",
    "provident-for-annuity"
  ],
  "variants": [],
  "rule_ids": [
    "PF-02",
    "REG-17"
  ],
  "source": {
    "url": "https://he.wikisource.org/wiki/חוק_הפיקוח_על_שירותים_פיננסיים_(קופות_גמל)",
    "title": "חוק הפיקוח על שירותים פיננסיים (קופות גמל), התשס\"ה-2005 (Wikisource mirror)",
    "publisher": "see title",
    "strength": "primary-mirror",
    "checked": "2026-10-22"
  }
}
