{
  "id": "prvpyl-chshyph-a",
  "he": "פרופיל חשיפה",
  "en": null,
  "meaning": "צמד תווים בשם הקרן שמראה עד כמה היא רשאית להיות חשופה למניות ולמטבע חוץ",
  "where": [
    "app",
    "fund-name",
    "statement"
  ],
  "wrapper_ids": [
    "brokerage-account",
    "money-market-fund-daily",
    "money-market-fund-renewable"
  ],
  "variants": [],
  "rule_ids": [
    "MF-43",
    "MF-54"
  ],
  "source": {
    "url": "https://www.new.isa.gov.il/images/Fittings/isa/asset_library_pic/al_lobby/al_lobby-64186b589b352/080217.pdf",
    "title": "ISA, מדריך למשקיע: קרנות נאמנות (updated January 2017)",
    "publisher": "Israel Securities Authority",
    "strength": "primary",
    "checked": "2026-10-22"
  }
}
