{
  "id": "mdd-hbsys",
  "he": "מדד הבסיס",
  "en": null,
  "meaning": "המדד שפורסם לפני שסדרת איגרות החוב הונפקה לראשונה; לפיו מחשבים בכמה עלו או ירדו הסכום והריבית",
  "where": [],
  "wrapper_ids": [
    "government-bond"
  ],
  "variants": [
    "המדד היסודי"
  ],
  "rule_ids": [
    "GOV-11"
  ],
  "source": {
    "url": "https://www.nevo.co.il/law_html/law01/999_564.htm",
    "title": "תקנות מילווה המדינה (איגרות חוב מסוג \"אג\"ח ממשלתית צמודה\"), תשס\"ו-2006 (Nevo mirror)",
    "publisher": "Nevo legal database",
    "strength": "primary-mirror",
    "checked": "2026-10-22"
  }
}
